{
  "schema_version": 1,
  "suite_id": "r11/snapshots-specialized-ec-v1",
  "status": "passed",
  "started_at": "2026-09-20T14:00:49Z",
  "finished_at": "2026-09-20T14:02:18Z",
  "schema_sha256": "436921f763199c5331ec326e7b148a5d354932c51c79114627a918c45b01838d",
  "rust": {
    "revision": "5a3191cbbb73fe0f2ad6afa36d8d15e52a870bac",
    "tree": "5ef23b2332696007ed1f2b1747f9ed6f2753ac18",
    "source_sha256": "931c0183faf7c6fb8393f665da1941d782c43596e61555de26955c2ccb45ad4d",
    "compiler_image": "rust:1.98.0-bookworm@sha256:82150a52ec202c1b14d7817e14516c392bb7f5cfebd88f1ed531cb37ebd39922",
    "platform": "linux/arm64",
    "binary_sha256": "a0a39b5fd154feb5e71e353dfa5a191f728095dc890918f60d3d50d28a42c932"
  },
  "go": {
    "revision": "c8bb148a1379b51ef87256c27f366a05f8da4dc4",
    "tree": "c5039b6b50a05b942a902f70dc2fcb090463e8c7",
    "compiler": "go1.26.8",
    "platform": "linux/arm64",
    "p10_driver_sha256": "43b9e50809f4569ca00af1228b69f1b835d1e74b5903cc4fbf66ee179f3ce54f",
    "focused_tests": "passed"
  },
  "native": {
    "version": "librados2-20.2.4-0.el9",
    "binary_sha256": "775c8d5bd128ba864e6f52b5d07dce7440ea73c1af4eb2e180815391c96f9c32",
    "seed": {
      "named_create_list_lookup_name_stamp": true,
      "named_read_rollback_remove": true,
      "self_managed_create_write_read_rollback_remove": true
    },
    "verify": {
      "rust_named_snapshot": true,
      "rust_named_head": true,
      "rust_copy": true,
      "rust_copy_from2": true,
      "rust_ec_copy": true,
      "rust_checksum_hex": "02000000f5be862af5be862a"
    }
  },
  "server": {
    "source_anchor_commit": "7f793731f1b39eb4f465e960113d2363c311b964",
    "version": "ceph version 20.2.4 (7f793731f1b39eb4f465e960113d2363c311b964) tentacle (stable)",
    "image": "quay.io/ceph/ceph@sha256:6e6bc7b28fa1b334108a3646af5533dfb50db508efdf5b358eb7dd0dd37a48aa",
    "binary_sha256": "5fbad656b7f1bd900a0c40990a81be8dff523555ed0b2c957e38f29beb33608a"
  },
  "cluster": {
    "fsid": "21111111-2222-4333-8444-111111111111",
    "osds": 3,
    "objectstore": "bluestore",
    "named_pool": {
      "name": "p11-named",
      "size": 2,
      "min_size": 1,
      "pg_num": 16
    },
    "self_managed_pool": {
      "name": "p11-self",
      "size": 2,
      "min_size": 1,
      "pg_num": 16
    },
    "ec_pool": {
      "name": "p11-ec",
      "size": 3,
      "min_size": 2,
      "pg_num": 16,
      "plugin": "jerasure",
      "k": 2,
      "m": 1,
      "failure_domain": "osd",
      "allow_ec_overwrites": false,
      "stripe_unit": 4096,
      "stripe_width": 8192
    }
  },
  "probe": {
    "named_create_list_lookup": true,
    "named_read_snapshot": true,
    "named_rollback": true,
    "named_remove": true,
    "self_managed_create": true,
    "self_managed_write_context": true,
    "self_managed_read": true,
    "self_managed_rollback": true,
    "self_managed_remove": true,
    "snapshot_context_validation": true,
    "write_same": true,
    "checksum": true,
    "checksum_hex": "02000000f5be862af5be862a",
    "allocation_hint": true,
    "sparse_read": true,
    "copy_from": true,
    "copy_from2": true,
    "replicated_capabilities": true,
    "ec_capabilities": true,
    "ec_write_read": true,
    "ec_overwrite_rejected": true,
    "ec_write_same_rejected": true,
    "ec_checksum": true,
    "ec_allocation_hint": true,
    "ec_sparse_read": true,
    "ec_copy_from": true,
    "ec_omap_rejected": true,
    "ec_alignment_evidence": true,
    "native_seed_read": true,
    "required_alignment": 8192
  },
  "scenarios": {
    "named_snapshots": "passed",
    "self_managed_snapshots": "passed",
    "snapshot_context_validation": "passed",
    "specialized_io": "passed",
    "erasure_coded_io": "passed",
    "native_interoperability": "passed"
  },
  "deviations": {
    "snapshot_views": "Rust represents mutable ioctx snapshot state as owned immutable Pool views.",
    "uncertain_monitor_mutations": "Cancellation or deadline after a monitor snapshot mutation is dispatched returns OutcomeUnknown and resets the monitor session.",
    "non_frozen_variants": [
      "rados_set_alloc_hint2",
      "rados_write_op_set_alloc_hint2",
      "IoCtx::list_snaps",
      "IoCtx::mapext",
      "IoCtx::pool_required_alignment",
      "IoCtx::pool_requires_alignment",
      "IoCtx::set_alloc_hint2",
      "ObjectReadOperation::list_snaps",
      "ObjectWriteOperation::set_alloc_hint2",
      "Rados::get_inconsistent_snapsets"
    ]
  }
}
